{
  "task_id": "2026-03-16-experience-store-pmax-booking-refresh",
  "brief_id": "lovefu-pmax-experience-store-booking-draft",
  "campaign_type": "pmax",
  "brand_name": "LOVEFU大島樂眠",
  "product_name": "睡眠體驗店預約",
  "generated_by": "codex",
  "generated_at": "2026-03-16T21:32:00+08:00",
  "angles": [
    {
      "key": "immersive_tryout",
      "label": "沉浸式試躺",
      "rationale": "保留目前最強的體驗店與沉浸式睡眠語言，延續現有效素材的吸引力。"
    },
    {
      "key": "guided_fit",
      "label": "顧問陪伴適配",
      "rationale": "延續睡眠顧問、量身打造、量脖子等高關聯語言，放大陪伴式服務感。"
    },
    {
      "key": "low_pressure_booking",
      "label": "低壓預約行動",
      "rationale": "補足既有素材中 booking headline 偏弱的缺口，把轉換收斂到預約體驗。"
    }
  ],
  "short_headlines": [
    {
      "text": "預約試躺 30 分沉浸式好眠",
      "angle_key": "immersive_tryout",
      "keyword_used": true
    },
    {
      "text": "體驗真正放鬆的慵懶時光",
      "angle_key": "immersive_tryout",
      "keyword_used": false
    },
    {
      "text": "沉浸式睡眠體驗 感受放鬆",
      "angle_key": "immersive_tryout",
      "keyword_used": false
    },
    {
      "text": "門市試躺 比規格更準",
      "angle_key": "immersive_tryout",
      "keyword_used": true
    },
    {
      "text": "床墊枕頭一次試躺",
      "angle_key": "immersive_tryout",
      "keyword_used": false
    },
    {
      "text": "你的專屬睡眠顧問",
      "angle_key": "guided_fit",
      "keyword_used": false
    },
    {
      "text": "量身打造你的專屬寢具組合",
      "angle_key": "guided_fit",
      "keyword_used": false
    },
    {
      "text": "專人測量頸部曲線",
      "angle_key": "guided_fit",
      "keyword_used": false
    },
    {
      "text": "睡眠顧問陪你慢慢找",
      "angle_key": "guided_fit",
      "keyword_used": false
    },
    {
      "text": "量脖子試枕一起安排",
      "angle_key": "guided_fit",
      "keyword_used": false
    },
    {
      "text": "不急著買 先預約體驗",
      "angle_key": "low_pressure_booking",
      "keyword_used": true
    },
    {
      "text": "先躺再選 更安心",
      "angle_key": "low_pressure_booking",
      "keyword_used": false
    },
    {
      "text": "預約體驗 找到適合睡感",
      "angle_key": "low_pressure_booking",
      "keyword_used": true
    },
    {
      "text": "預約門市試躺 更安心",
      "angle_key": "low_pressure_booking",
      "keyword_used": true
    },
    {
      "text": "就近預約體驗 更方便",
      "angle_key": "low_pressure_booking",
      "keyword_used": true
    }
  ],
  "long_headlines": [
    {
      "text": "還在看網路推薦卻不知道適不適合？不如先到體驗店試躺，親自感受更準。",
      "angle_key": "immersive_tryout"
    },
    {
      "text": "體驗過沉浸式睡眠了嗎？來體驗店躺一躺，你會更快知道什麼睡感適合自己。",
      "angle_key": "immersive_tryout"
    },
    {
      "text": "睡眠顧問陪你比較床墊與枕頭，量脖子後再慢慢找到適合自己的睡感。",
      "angle_key": "guided_fit"
    },
    {
      "text": "不急著買也沒關係，先預約體驗，讓身體被接住後再決定下一步。",
      "angle_key": "low_pressure_booking"
    },
    {
      "text": "量脖子、試枕、試躺一次安排，用更低壓的方式找到適合自己的寢具組合。",
      "angle_key": "guided_fit"
    }
  ],
  "descriptions": [
    {
      "text": "先預約體驗，再決定下一步。",
      "angle_key": "low_pressure_booking"
    },
    {
      "text": "還在看網路推薦卻不知道適不適合自己？到體驗店實際試躺，會比只看規格更有感。",
      "angle_key": "immersive_tryout"
    },
    {
      "text": "睡眠顧問會陪你比較床墊、枕頭與支撐感，不必急著下決定，也能慢慢找到適合的組合。",
      "angle_key": "guided_fit"
    },
    {
      "text": "量脖子、試枕、試躺可以一起安排，把預約體驗排進生活節奏裡，更安心也更有效率。",
      "angle_key": "guided_fit"
    },
    {
      "text": "就近預約體驗店，先感受沉浸式試躺與放鬆流程，再慢慢決定下一步帶什麼回家。",
      "angle_key": "low_pressure_booking"
    }
  ],
  "compliance_notes": {
    "manual_review_required": true,
    "checks_passed": [
      "exact_counts",
      "char_limits",
      "one_short_description",
      "three_distinct_angles",
      "keyword_message_fit"
    ],
    "policy_risks": [
      "建議此 ad set 導向 https://www.lovefu.tw/pages/lovefuhome；若落到 hillbed 商品頁，booking intent 會被產品購買流程稀釋。",
      "若要寫出具體門市地區資訊，需先核對實際 LP 與投放設定。"
    ],
    "brand_risks": [
      "資料只有素材關聯轉換 proxy，保留與替換判斷屬 directional，不應當成最終投放結論。",
      "本次刻意移除城市名以支援三店合併投放，若後續要拆地區版位需再做在地化補稿。"
    ]
  }
}
