{
  "task_id": "gads-copy-002",
  "brief_id": "tc-lovefu-mattress-pmax",
  "campaign_type": "pmax",
  "brand_name": "LOVEFU大島樂眠",
  "product_name": "獨立筒護腰床墊",
  "generated_by": "codex",
  "generated_at": "2026-03-14T11:30:00+08:00",
  "angles": [
    {
      "key": "product_support",
      "label": "產品支撐",
      "rationale": "把獨立筒、護腰與穩定托住感放在第一層，讓 PMax 有清楚的產品事實可重組。"
    },
    {
      "key": "pain_relief",
      "label": "放鬆痛點",
      "rationale": "回應久坐腰背緊與難放鬆的情境，但避免醫療承諾。"
    },
    {
      "key": "trial_confidence",
      "label": "試躺信任",
      "rationale": "用試躺、睡眠顧問與安心睡計畫建立轉換信任。"
    }
  ],
  "short_headlines": [
    { "text": "大島樂眠 獨立筒床墊", "angle_key": "product_support", "keyword_used": true },
    { "text": "護腰床墊 先試再選", "angle_key": "product_support", "keyword_used": true },
    { "text": "獨立筒支撐 穩穩托住", "angle_key": "product_support", "keyword_used": true },
    { "text": "床墊推薦 看支撐感", "angle_key": "product_support", "keyword_used": true },
    { "text": "硬式支撐 不只看規格", "angle_key": "product_support", "keyword_used": false },
    { "text": "久坐腰緊 找對支撐", "angle_key": "pain_relief", "keyword_used": false },
    { "text": "讓身體先被接住", "angle_key": "pain_relief", "keyword_used": false },
    { "text": "睡得更放鬆 從床開始", "angle_key": "pain_relief", "keyword_used": false },
    { "text": "腰背緊 先試躺再決定", "angle_key": "pain_relief", "keyword_used": false },
    { "text": "晚安歡迎回家 好好睡", "angle_key": "pain_relief", "keyword_used": false },
    { "text": "台北床墊試躺推薦", "angle_key": "trial_confidence", "keyword_used": true },
    { "text": "預約試躺 找到合適床墊", "angle_key": "trial_confidence", "keyword_used": false },
    { "text": "睡眠顧問陪你挑床墊", "angle_key": "trial_confidence", "keyword_used": false },
    { "text": "安心睡計畫 更放心", "angle_key": "trial_confidence", "keyword_used": false },
    { "text": "大島樂眠 預約試躺", "angle_key": "trial_confidence", "keyword_used": false }
  ],
  "long_headlines": [
    {
      "text": "從獨立筒到護腰支撐，先試躺再找到更適合自己的床墊",
      "angle_key": "product_support"
    },
    {
      "text": "久坐腰背容易緊，也能用穩穩托住感慢慢找回放鬆睡眠",
      "angle_key": "pain_relief"
    },
    {
      "text": "門市試躺搭配睡眠顧問，讓選床墊不再只是看規格與價格",
      "angle_key": "trial_confidence"
    },
    {
      "text": "大島樂眠用安心睡計畫與真實體驗，陪你慢慢挑到適合的床",
      "angle_key": "trial_confidence"
    },
    {
      "text": "如果你想先被好好接住，再決定哪張床適合你，歡迎預約試躺",
      "angle_key": "pain_relief"
    }
  ],
  "descriptions": [
    {
      "text": "門市試躺 找到合適床墊",
      "angle_key": "trial_confidence"
    },
    {
      "text": "大島樂眠提供門市試躺與睡眠顧問協助，陪你比較支撐、包覆與放鬆感差異。",
      "angle_key": "trial_confidence"
    },
    {
      "text": "從獨立筒到護腰支撐，讓身體先被接住，再慢慢找到更安心的睡眠節奏。",
      "angle_key": "product_support"
    },
    {
      "text": "如果你久坐腰背容易緊，歡迎先試躺，感受更穩定的托住感與放鬆睡感。",
      "angle_key": "pain_relief"
    },
    {
      "text": "安心睡計畫讓你不急著只看價格，而是用身體真實感受挑到適合自己的床墊。",
      "angle_key": "trial_confidence"
    }
  ],
  "compliance_notes": {
    "manual_review_required": true,
    "checks_passed": [
      "exact_counts",
      "char_limits",
      "one_short_description",
      "three_distinct_angles"
    ],
    "policy_risks": [
      "腰背相關字眼需避免被寫成醫療改善承諾"
    ],
    "brand_risks": [
      "試躺與安心睡計畫需和實際 landing page 承接一致"
    ]
  }
}
