{
  "task_id": "prod-001-dryrun-codex",
  "brief_id": "lovefu-pmax-hillbed",
  "campaign_type": "pmax",
  "brand_name": "LOVEFU大島樂眠",
  "product_name": "山丘樂眠床",
  "generated_by": "codex",
  "generated_at": "2026-03-14T22:15:00+08:00",
  "angles": [
    {
      "key": "body-first-comfort",
      "label": "身體先被接住",
      "rationale": "從躺下那一刻的身體感受切入，把高密度慢回彈泡棉、高碳鋼獨立筒與安心認證轉成可被重組的產品事實。"
    },
    {
      "key": "worry-free-choice",
      "label": "選床不怕錯",
      "rationale": "用100天安心睡全額退款與10年保固，回應買床最怕選錯、買了不能回頭的壓力。"
    },
    {
      "key": "smart-start",
      "label": "聰明入門",
      "rationale": "把14,900起的入門定位限制在價值角度，對接第2張床或首次升級的需求，但不擴散成整包價格訊號。"
    }
  ],
  "short_headlines": [
    {
      "text": "床墊推薦 先睡出放鬆感",
      "angle_key": "body-first-comfort",
      "keyword_used": true
    },
    {
      "text": "獨立筒床墊 穩穩接住身體",
      "angle_key": "body-first-comfort",
      "keyword_used": true
    },
    {
      "text": "支撐床墊 讓腰背慢慢放鬆",
      "angle_key": "body-first-comfort",
      "keyword_used": true
    },
    {
      "text": "山丘樂眠床 睡得更安心",
      "angle_key": "body-first-comfort",
      "keyword_used": false
    },
    {
      "text": "高碳鋼獨立筒 支撐更穩",
      "angle_key": "body-first-comfort",
      "keyword_used": false
    },
    {
      "text": "慢回彈泡棉 包覆更剛好",
      "angle_key": "body-first-comfort",
      "keyword_used": false
    },
    {
      "text": "100天安心睡 放心試",
      "angle_key": "worry-free-choice",
      "keyword_used": false
    },
    {
      "text": "10年保固 陪你睡更久",
      "angle_key": "worry-free-choice",
      "keyword_used": false
    },
    {
      "text": "買床怕選錯 先安心睡",
      "angle_key": "worry-free-choice",
      "keyword_used": false
    },
    {
      "text": "先睡100天 再慢慢決定",
      "angle_key": "worry-free-choice",
      "keyword_used": false
    },
    {
      "text": "獨立筒床墊 安心試睡",
      "angle_key": "worry-free-choice",
      "keyword_used": true
    },
    {
      "text": "14,900起 入門不將就",
      "angle_key": "smart-start",
      "keyword_used": false
    },
    {
      "text": "入門床墊 也要好支撐",
      "angle_key": "smart-start",
      "keyword_used": false
    },
    {
      "text": "第2張床 從山丘開始",
      "angle_key": "smart-start",
      "keyword_used": false
    },
    {
      "text": "山丘樂眠床 立即選購",
      "angle_key": "smart-start",
      "keyword_used": false
    }
  ],
  "long_headlines": [
    {
      "text": "山丘樂眠床用高密度慢回彈泡棉搭配高碳鋼獨立筒，讓每晚都被穩穩接住",
      "angle_key": "body-first-comfort"
    },
    {
      "text": "想找床墊推薦？先看支撐品質，山丘樂眠床把安心與放鬆一起放進每次躺下",
      "angle_key": "body-first-comfort"
    },
    {
      "text": "100天安心睡全額退款與10年保固，讓選山丘樂眠床不用急著一次決定",
      "angle_key": "worry-free-choice"
    },
    {
      "text": "14,900起的入門系列，讓第2張床也能有不將就的支撐與安心",
      "angle_key": "smart-start"
    },
    {
      "text": "正在比較獨立筒床墊？山丘樂眠床從支撐到安心都替你先想好",
      "angle_key": "smart-start"
    }
  ],
  "descriptions": [
    {
      "text": "100天安心睡 讓選床少點壓力",
      "angle_key": "worry-free-choice"
    },
    {
      "text": "山丘樂眠床以MDI高密度慢回彈泡棉搭配2.4mm高碳鋼獨立筒，讓支撐與包覆一起到位。",
      "angle_key": "body-first-comfort"
    },
    {
      "text": "通過歐盟CertiPUR與OEKO-TEX安全檢測，讓支撐床墊的安心感不只停在感覺。",
      "angle_key": "body-first-comfort"
    },
    {
      "text": "100天安心睡全額退款搭配10年保固，買床不用急，慢慢睡過再決定是不是適合自己。",
      "angle_key": "worry-free-choice"
    },
    {
      "text": "14,900起的入門定位，不用喊低價，也能把好支撐與放鬆感一起帶回家。",
      "angle_key": "smart-start"
    }
  ],
  "compliance_notes": {
    "manual_review_required": true,
    "checks_passed": [
      "exact_counts",
      "char_limits",
      "one_short_description",
      "three_distinct_angles",
      "angle_coverage_check",
      "keyword_message_fit_check",
      "must_include_terms_present",
      "no_forbidden_claims"
    ],
    "policy_risks": [
      "接住身體與腰背放鬆屬感受描述，上稿前仍需人工確認沒有越過醫療承諾邊界"
    ],
    "brand_risks": [
      "14,900起、100天安心睡與10年保固需與官網商品頁當前資訊一致"
    ]
  }
}
